[
{
"id": "20251212T010000Z_001",
"tema": "Artes",
"tema_clean": "artes",
"subtema": "Literatura",
"subtema_clean": "literatura",
"microsubtema": "Modernismo e Vanguardas do Século XX",
"microsubtema_clean": "modernismo_e_vanguardas_literarias",
"tipo": "Aberta",
"pergunta": "Qual movimento literário do início do século XX ficou marcado pela ruptura com formas tradicionais e pela experimentação de linguagem em romances, contos e poemas?",
"resposta": "Modernismo",
"fonte": [
"[https://en.wikipedia.org/wiki/Modernism](https://en.wikipedia.org/wiki/Modernism)",
"[https://www.britannica.com/art/Modernism](https://www.britannica.com/art/Modernism)"
]
},
{
"id": "20251212T010000Z_002",
"tema": "Artes",
"tema_clean": "artes",
"subtema": "Literatura",
"subtema_clean": "literatura",
"microsubtema": "Modernismo e Vanguardas do Século XX",
"microsubtema_clean": "modernismo_e_vanguardas_literarias",
"tipo": "Aberta",
"pergunta": "Como se chama a técnica narrativa que tenta registrar de forma direta o fluxo de pensamentos e sensações de uma personagem, muito usada por autores modernistas?",
"resposta": "Fluxo de consciência",
"fonte": [
"[https://en.wikipedia.org/wiki/Stream_of_consciousness_(narrative_mode)](https://en.wikipedia.org/wiki/Stream_of_consciousness_%28narrative_mode%29)",
"[https://www.britannica.com/art/stream-of-consciousness](https://www.britannica.com/art/stream-of-consciousness)"
]
},
{
"id": "20251212T010000Z_003",
"tema": "Artes",
"tema_clean": "artes",
"subtema": "Literatura",
"subtema_clean": "literatura",
"microsubtema": "Modernismo e Vanguardas do Século XX",
"microsubtema_clean": "modernismo_e_vanguardas_literarias",
"tipo": "Aberta",
"pergunta": "Qual cidade europeia serve de cenário principal para o romance modernista Ulisses, publicado em 1922?",
"resposta": "Dublin",
"fonte": [
"[https://en.wikipedia.org/wiki/Dublin](https://en.wikipedia.org/wiki/Dublin)",
"[https://en.wikipedia.org/wiki/Ulysses_(novel)](https://en.wikipedia.org/wiki/Ulysses_%28novel%29)"
]
},
{
"id": "20251212T010000Z_004",
"tema": "Artes",
"tema_clean": "artes",
"subtema": "Literatura",
"subtema_clean": "literatura",
"microsubtema": "Modernismo e Vanguardas do Século XX",
"microsubtema_clean": "modernismo_e_vanguardas_literarias",
"tipo": "Aberta",
"pergunta": "Quem é o autor do romance modernista Ulisses, publicado em 1922 e ambientado em Dublin?",
"resposta": "James Joyce",
"fonte": [
"[https://en.wikipedia.org/wiki/James_Joyce](https://en.wikipedia.org/wiki/James_Joyce)",
"[https://en.wikipedia.org/wiki/Ulysses_(novel)](https://en.wikipedia.org/wiki/Ulysses_%28novel%29)"
]
},
{
"id": "20251212T010000Z_005",
"tema": "Artes",
"tema_clean": "artes",
"subtema": "Literatura",
"subtema_clean": "literatura",
"microsubtema": "Modernismo e Vanguardas do Século XX",
"microsubtema_clean": "modernismo_e_vanguardas_literarias",
"tipo": "Aberta",
"pergunta": "Qual é o título do romance modernista conhecido pela linguagem extremamente experimental e pelo uso intenso de jogos de palavras, publicado em 1939 por um escritor irlandês?",
"resposta": "Finnegans Wake",
"fonte": [
"[https://en.wikipedia.org/wiki/Finnegans_Wake](https://en.wikipedia.org/wiki/Finnegans_Wake)",
"[https://www.britannica.com/topic/Finnegans-Wake](https://www.britannica.com/topic/Finnegans-Wake)"
]
},
{
"id": "20251212T010000Z_006",
"tema": "Artes",
"tema_clean": "artes",
"subtema": "Literatura",
"subtema_clean": "literatura",
"microsubtema": "Modernismo e Vanguardas do Século XX",
"microsubtema_clean": "modernismo_e_vanguardas_literarias",
"tipo": "Aberta",
"pergunta": "Como se chama a coletânea de contos modernistas que retrata o cotidiano de diferentes habitantes de Dublin no início do século XX?",
"resposta": "Dubliners",
"fonte": [
"[https://en.wikipedia.org/wiki/Dubliners](https://en.wikipedia.org/wiki/Dubliners)",
"[https://www.britannica.com/topic/Dubliners](https://www.britannica.com/topic/Dubliners)"
]
},
{
"id": "20251212T010000Z_007",
"tema": "Artes",
"tema_clean": "artes",
"subtema": "Literatura",
"subtema_clean": "literatura",
"microsubtema": "Modernismo e Vanguardas do Século XX",
"microsubtema_clean": "modernismo_e_vanguardas_literarias",
"tipo": "Aberta",
"pergunta": "Que escritor de origem tcheca, ligado ao modernismo, é autor da novela A Metamorfose, em que um homem acorda transformado em inseto?",
"resposta": "Franz Kafka",
"fonte": [
"[https://en.wikipedia.org/wiki/Franz_Kafka](https://en.wikipedia.org/wiki/Franz_Kafka)",
"[https://en.wikipedia.org/wiki/The_Metamorphosis](https://en.wikipedia.org/wiki/The_Metamorphosis)"
]
},
{
"id": "20251212T010000Z_008",
"tema": "Artes",
"tema_clean": "artes",
"subtema": "Literatura",
"subtema_clean": "literatura",
"microsubtema": "Modernismo e Vanguardas do Século XX",
"microsubtema_clean": "modernismo_e_vanguardas_literarias",
"tipo": "Aberta",
"pergunta": "Qual romance de Franz Kafka acompanha Josef K, um homem subitamente acusado por uma autoridade distante e nunca totalmente explicada?",
"resposta": "O Processo",
"fonte": [
"[https://en.wikipedia.org/wiki/The_Trial](https://en.wikipedia.org/wiki/The_Trial)",
"[https://www.britannica.com/topic/The-Trial-novel-by-Kafka](https://www.britannica.com/topic/The-Trial-novel-by-Kafka)"
]
},
{
"id": "20251212T010000Z_009",
"tema": "Artes",
"tema_clean": "artes",
"subtema": "Literatura",
"subtema_clean": "literatura",
"microsubtema": "Modernismo e Vanguardas do Século XX",
"microsubtema_clean": "modernismo_e_vanguardas_literarias",
"tipo": "Aberta",
"pergunta": "Em que cidade europeia vive o protagonista de muitas narrativas ligadas ao autor de A Metamorfose, hoje associada a passeios literários pela sua obra?",
"resposta": "Praga",
"fonte": [
"[https://en.wikipedia.org/wiki/Prague](https://en.wikipedia.org/wiki/Prague)",
"[https://en.wikipedia.org/wiki/Franz_Kafka](https://en.wikipedia.org/wiki/Franz_Kafka)"
]
},
{
"id": "20251212T010000Z_010",
"tema": "Artes",
"tema_clean": "artes",
"subtema": "Literatura",
"subtema_clean": "literatura",
"microsubtema": "Modernismo e Vanguardas do Século XX",
"microsubtema_clean": "modernismo_e_vanguardas_literarias",
"tipo": "Aberta",
"pergunta": "Que escritora inglesa modernista é autora de romances como Mrs Dalloway e Ao Farol, conhecidos pelo uso de monólogo interior?",
"resposta": "Virginia Woolf",
"fonte": [
"[https://en.wikipedia.org/wiki/Virginia_Woolf](https://en.wikipedia.org/wiki/Virginia_Woolf)",
"[https://www.britannica.com/biography/Virginia-Woolf](https://www.britannica.com/biography/Virginia-Woolf)"
]
},
{
"id": "20251212T010000Z_011",
"tema": "Artes",
"tema_clean": "artes",
"subtema": "Literatura",
"subtema_clean": "literatura",
"microsubtema": "Modernismo e Vanguardas do Século XX",
"microsubtema_clean": "modernismo_e_vanguardas_literarias",
"tipo": "Aberta",
"pergunta": "Qual romance de Virginia Woolf acompanha um dia na vida de Clarissa em Londres, alternando a consciência de diferentes personagens ao longo do dia?",
"resposta": "Mrs Dalloway",
"fonte": [
"[https://en.wikipedia.org/wiki/Mrs_Dalloway](https://en.wikipedia.org/wiki/Mrs_Dalloway)",
"[https://www.britannica.com/topic/Mrs-Dalloway-novel-by-Woolf](https://www.britannica.com/topic/Mrs-Dalloway-novel-by-Woolf)"
]
},
{
"id": "20251212T010000Z_012",
"tema": "Artes",
"tema_clean": "artes",
"subtema": "Literatura",
"subtema_clean": "literatura",
"microsubtema": "Modernismo e Vanguardas do Século XX",
"microsubtema_clean": "modernismo_e_vanguardas_literarias",
"tipo": "Aberta",
"pergunta": "Quem escreveu o longo ciclo de romances Em Busca do Tempo Perdido, em que a memória e as lembranças de infância ganham papel central?",
"resposta": "Marcel Proust",
"fonte": [
"[https://en.wikipedia.org/wiki/Marcel_Proust](https://en.wikipedia.org/wiki/Marcel_Proust)",
"[https://en.wikipedia.org/wiki/In_Search_of_Lost_Time](https://en.wikipedia.org/wiki/In_Search_of_Lost_Time)"
]
},
{
"id": "20251212T010000Z_013",
"tema": "Artes",
"tema_clean": "artes",
"subtema": "Literatura",
"subtema_clean": "literatura",
"microsubtema": "Modernismo e Vanguardas do Século XX",
"microsubtema_clean": "modernismo_e_vanguardas_literarias",
"tipo": "Aberta",
"pergunta": "Qual cidade francesa é frequentemente associada aos círculos literários modernistas e à vida de Marcel Proust no início do século XX?",
"resposta": "Paris",
"fonte": [
"[https://en.wikipedia.org/wiki/Paris](https://en.wikipedia.org/wiki/Paris)",
"[https://en.wikipedia.org/wiki/Marcel_Proust](https://en.wikipedia.org/wiki/Marcel_Proust)"
]
},
{
"id": "20251212T010000Z_014",
"tema": "Artes",
"tema_clean": "artes",
"subtema": "Literatura",
"subtema_clean": "literatura",
"microsubtema": "Modernismo e Vanguardas do Século XX",
"microsubtema_clean": "modernismo_e_vanguardas_literarias",
"tipo": "Aberta",
"pergunta": "Como ficou conhecido o evento realizado no Teatro Municipal de São Paulo em 1922, considerado marco simbólico do modernismo brasileiro?",
"resposta": "Semana de Arte Moderna",
"fonte": [
"[https://en.wikipedia.org/wiki/Week_of_Modern_Art](https://en.wikipedia.org/wiki/Week_of_Modern_Art)",
"[https://enciclopedia.itaucultural.org.br/evento288938/semana-de-arte-moderna](https://enciclopedia.itaucultural.org.br/evento288938/semana-de-arte-moderna)"
]
},
{
"id": "20251212T010000Z_015",
"tema": "Artes",
"tema_clean": "artes",
"subtema": "Literatura",
"subtema_clean": "literatura",
"microsubtema": "Modernismo e Vanguardas do Século XX",
"microsubtema_clean": "modernismo_e_vanguardas_literarias",
"tipo": "Aberta",
"pergunta": "Que escritor brasileiro modernista é autor do Manifesto Antropófago e participou ativamente da Semana de Arte Moderna?",
"resposta": "Oswald de Andrade",
"fonte": [
"[https://en.wikipedia.org/wiki/Oswald_de_Andrade](https://en.wikipedia.org/wiki/Oswald_de_Andrade)",
"[https://enciclopedia.itaucultural.org.br/pessoa26/oswald-de-andrade](https://enciclopedia.itaucultural.org.br/pessoa26/oswald-de-andrade)"
]
},
{
"id": "20251212T010000Z_016",
"tema": "Artes",
"tema_clean": "artes",